Name,Slug,Collection ID,Locale ID,Item ID,Created On,Updated On,Published On,Body,Color,Excerpt,Featured Topic,Photo
Data/IO,data,64f2b0ceb3c1ea886791b59b,64f2b0cd9c0d653c3c55ca45,64f2c30f59342fcfbae4634d,Sat Sep 02 2023 05:07:27 GMT+0000 (Coordinated Universal Time),Thu Jan 25 2024 02:01:33 GMT+0000 (Coordinated Universal Time),Thu Jan 25 2024 02:03:08 GMT+0000 (Coordinated Universal Time),"<h1 id="""">Data/IO in EHS Management: The Backbone of Decision-Making for EHS Directors</h1><h2 id="""">Introduction</h2><p id="""">In the digital age, data is often referred to as the ""new oil,"" serving as a valuable resource for driving decisions and strategies. For EHS Directors, data input/output (Data/IO) is the backbone of effective management in the realms of Environment, Health, and Safety. Explore how our Data/IO capabilities can significantly enhance the role of EHS Directors, making data management more streamlined, secure, and insightful.</p><h2 id="""">Centralized Data Repository</h2><h3 id="""">Why It Matters</h3><p id="""">EHS Directors often deal with a plethora of data sources, including compliance reports, incident logs, and employee training records. Managing this data across disparate systems can be challenging and time-consuming.</p><h3 id="""">How Our Data/IO Helps</h3><p id="""">Our platform serves as a centralized repository for all your EHS data. This ensures easy access, better data integrity, and seamless integration with other enterprise systems.</p><h2 id="""">Real-Time Data Capture and Analysis</h2><h3 id="""">Why It Matters</h3><p id="""">In EHS management, real-time data is crucial for immediate decision-making, especially in emergency situations or when compliance deadlines are looming.</p><h3 id="""">How Our Data/IO Helps</h3><p id="""">Our Data/IO capabilities enable real-time data capture from various sources, including IoT devices and manual inputs. This data is then analyzed in real-time, providing EHS Directors with actionable insights when they need them the most.</p><h2 id="""">Secure Data Transmission</h2><h3 id="""">Why It Matters</h3><p id="""">Data security is a paramount concern, especially when dealing with sensitive information like employee health records or confidential compliance reports.</p><h3 id="""">How Our Data/IO Helps</h3><p id="""">Our platform ensures secure data transmission through robust encryption protocols. This gives EHS Directors peace of mind, knowing that their data is protected from unauthorized access or breaches.</p><h2 id="""">Automated Data Validation</h2><h3 id="""">Why It Matters</h3><p id="""">Incorrect or incomplete data can lead to flawed decision-making and potential compliance issues, making data validation a critical task for EHS Directors.</p><h3 id="""">How Our Data/IO Helps</h3><p id="""">Our system automatically validates data upon entry, flagging any inconsistencies or errors for immediate correction. This ensures that the data you rely on for decision-making is accurate and complete.</p><h2 id="""">Customizable Reporting and Dashboards</h2><h3 id="""">Why It Matters</h3><p id="""">EHS Directors need to generate various reports for internal analysis, stakeholder communication, and regulatory compliance. Customizable reporting options can make this process more efficient.</p><h3 id="""">How Our Data/IO Helps</h3><p id="""">Our Data/IO features include customizable reporting and dashboards, allowing you to generate reports that meet your specific needs. Whether it's a detailed compliance report or a high-level safety performance dashboard, our platform has you covered.</p><h2 id="""">Conclusion</h2><p id="""">Data/IO is not just a technical term; it's the cornerstone of effective EHS management. Our advanced Data/IO capabilities offer EHS Directors a robust tool for centralized data storage, real-time analysis, secure transmission, automated validation, and customizable reporting. By leveraging these features, EHS Directors can make data-driven decisions that enhance safety, ensure compliance, and drive continuous improvement in their organizations.</p>","hsla(75, 100.00%, 50.00%, 1.00)","Lorem Ipsum is simply dummy text of the printing and typesetting industry. Lorem Ipsum has been the industry's standard dummy text ever since the 1500s, when an unknown printer took a galley of type and scrambled it to make a type specimen book.",false,
Director of Risk,risk-director,64f2b0ceb3c1ea886791b59b,64f2b0cd9c0d653c3c55ca45,64f54c2887a8d9a399145403,Mon Sep 04 2023 03:16:56 GMT+0000 (Coordinated Universal Time),Thu Oct 12 2023 19:40:18 GMT+0000 (Coordinated Universal Time),Thu Oct 12 2023 19:45:24 GMT+0000 (Coordinated Universal Time),"<h1 id="""">Transforming the Role of Risk Directors with Our Advanced EHS Solution</h1><h2 id="""">Introduction</h2><p id="""">Risk Directors occupy a critical position in an organization, overseeing the assessment, quantification, and mitigation of various risks. Their role often involves a complex blend of strategic planning, data analysis, and administrative oversight. Our innovative EHS Platform is engineered to meet the unique needs of Risk Directors, offering a tool that not only reduces overall operational risk but also automates many routine tasks. This allows Risk Directors to focus more on strategic efforts, while also optimizing the work of Risk Managers. In this article, we explore how our solution can be a transformative asset for Risk Directors.</p><h2 id="""">Automated Risk Assessment for Strategic Insight</h2><h3 id="""">Why It Matters to Risk Directors</h3><p id="""">Risk assessment is a cornerstone for Risk Directors, requiring a deep dive into numbers and various risk factors. This often involves coordination with Risk Managers and can be bogged down by manual data entry.</p><h3 id="""">How Our Solution Helps</h3><p id="""">Our EHS solution automates the risk assessment process, allowing Risk Directors and Risk Managers alike to focus on strategic analysis rather than data entry. The platform's robust analytics tools offer real-time insights into various risk factors, enabling more accurate and timely decision-making.</p><h2 id="""">Efficiency Through Automation</h2><h3 id="""">Why It Matters to Risk Directors</h3><p id="""">Risk Directors often oversee multiple tasks, from data collection and analysis to communication with Risk Managers and other personnel. Manual handling of these tasks can be inefficient and can divert attention from strategic efforts.</p><h3 id="""">How Our Solution Helps</h3><p id="""">Our solution offers powerful automation features that can handle a range of activities, from data collection to automated outreach. This frees up time for Risk Directors to focus on strategic planning and other high-level tasks, while also making the work of Risk Managers more efficient.</p><h2 id="""">Holistic Operational Risk Management</h2><h3 id="""">Why It Matters to Risk Directors</h3><p id="""">Reducing operational risks is a key objective for Risk Directors. Achieving this requires a comprehensive understanding of various risk factors and the ability to implement effective mitigation strategies, often in coordination with Risk Managers.</p><h3 id="""">How Our Solution Helps</h3><p id="""">Our EHS solution provides a holistic view of operational risks, integrating data from various sources for a comprehensive analysis. The platform also allows Risk Directors to implement and track mitigation strategies, ensuring effective risk management across the board.</p><h2 id="""">Shifting from Administrative to Strategic Focus</h2><h3 id="""">Why It Matters to Risk Directors</h3><p id="""">Risk Directors are most effective when they can focus on strategic efforts that align with the organization's objectives. Administrative tasks, although necessary, can often be a distraction and are usually delegated to Risk Managers.</p><h3 id="""">How Our Solution Helps</h3><p id="""">By automating many of the routine administrative tasks, our platform allows Risk Directors to spend more time on strategic efforts. Whether it's long-term risk mitigation planning or aligning EHS initiatives with business goals, our platform enables a more strategic focus, while also streamlining the tasks of Risk Managers.</p><h2 id="""">Conclusion</h2><p id="""">Risk Directors are the strategic leaders in organizational safety and sustainability, tasked with the critical role of identifying and mitigating risks. Our advanced EHS Platform is designed to empower Risk Directors, offering them a streamlined, automated, and highly analytical tool for their unique challenges. By leveraging the capabilities of our platform, Risk Directors can elevate their role and that of their Risk Managers, achieving unparalleled levels of efficiency, risk mitigation, and strategic focus.</p>","hsla(22, 100.00%, 50.00%, 1.00)","Lorem Ipsum is simply dummy text of the printing and typesetting industry. Lorem Ipsum has been the industry's standard dummy text ever since the 1500s, when an unknown printer took a galley of type and scrambled it to make a type specimen book.",false,
EHS Administration,ehs-administration,64f2b0ceb3c1ea886791b59b,64f2b0cd9c0d653c3c55ca45,654145a879ccfc105ee6363a,Tue Oct 31 2023 18:21:28 GMT+0000 (Coordinated Universal Time),Tue Oct 31 2023 18:23:19 GMT+0000 (Coordinated Universal Time),Tue Oct 31 2023 18:23:26 GMT+0000 (Coordinated Universal Time),"<h1 id=""""><strong id="""">Our Environmental, Health, and Safety (EHS) Administrative Services: Streamlining EHS Administration for EHS Directors and their Teams</strong></h1><p id="""">Recognizing the multifaceted and often taxing nature of EHS roles, we offer a comprehensive suite of EHS Administration services. These services are meticulously designed to lighten the administrative load that so frequently burdens EHS Directors.</p><h2 id="""">Why Opt for Our EHS Administration Services?</h2><ol id=""""><li id=""""><strong id="""">Proven EHS Administrative Expertise</strong>: Our team brings years of experience to the table, proficient in handling the intricate, compliance-focused aspects of EHS management. This expertise ensures that your EHS administration is managed effectively, efficiently, and in compliance.</li><li id=""""><strong id="""">Customization to Your Specific Needs</strong>: We understand that each organization has its own set of EHS challenges and requirements. Our services are, therefore, customized to perfectly fit your unique needs, whether it’s handling documentation, coordinating EHS training sessions, or maintaining regulatory compliance.</li><li id=""""><strong id="""">Enhanced Focus on Core EHS Strategies</strong>: By entrusting us with administrative tasks, EHS Directors can redirect their attention towards the development and implementation of essential EHS strategies. This can lead to more innovative and effective safety and health measures within your organization.</li><li id=""""><strong id="""">Cost-Effective Solutions</strong>: Outsourcing EHS administration can be a more economical option compared to managing all tasks internally. Our services can reduce the need for additional staffing and minimize costs associated with administrative oversights or non-compliance.</li><li id=""""><strong id="""">Up-to-Date with EHS Regulations</strong>: Keeping up with constant changes in EHS regulations is challenging. Our team stays current with these changes, ensuring your organization remains compliant and proactive in regulatory matters.</li></ol><h2 id="""">Our EHS Administration Services Include:</h2><ul id=""""><li id=""""><strong id="""">Regulatory Compliance Management</strong>: Ensuring your organization adheres to all relevant local, state, and federal EHS regulations.</li><li id=""""><strong id="""">Record Keeping and Reporting</strong>: Managing all EHS-related documentation, such as incident reports, inspection records, and training logs, ensuring they are accurate and easily accessible.</li><li id=""""><strong id="""">EHS Training Coordination</strong>: Organizing and managing EHS training programs, including scheduling, preparing materials, and monitoring employee participation.</li><li id=""""><strong id="""">Policy and Procedure Development</strong>: Assisting in creating and updating EHS policies and procedures that meet your organization's specific needs.</li><li id=""""><strong id="""">Auditing and Inspection Assistance</strong>: Performing regular EHS audits and inspections, offering insights and recommendations to maintain and improve EHS standards.</li><li id=""""><strong id="""">Risk Assessment and Management</strong>: Identifying potential EHS risks in your workplace and developing strategies to mitigate these risks.</li><li id=""""><strong id="""">Emergency Response Plan Development</strong>: Assisting in developing and refining emergency response plans, ensuring preparedness for unforeseen events.</li><li id=""""><strong id="""">Stakeholder Communication Management</strong>: Handling communication with stakeholders, including employees, regulatory bodies, and management, ensuring effective information flow.</li></ul><h2 id="""">Focus on EHS Leadership While We Handle the Details</h2><p id="""">Our EHS Administration services aim to relieve EHS Directors from the intricacies of daily administrative tasks, enabling them to concentrate on strategic leadership and proactive EHS initiatives. Partner with us for streamlined EHS administration and to elevate the efficacy of your organization's EHS programs.</p><p id=""""><strong id="""">Contact us today</strong> to discover how we can tailor our services to your specific EHS needs, helping you lead a safer, more compliant, and efficient workplace.</p><p id="""">‍</p>",,,false,
EHS Compliance,ehs-compliance,64f2b0ceb3c1ea886791b59b,64f2b0cd9c0d653c3c55ca45,64f3b31d2eb338d5b0e358d5,Sat Sep 02 2023 22:11:41 GMT+0000 (Coordinated Universal Time),Wed Sep 06 2023 16:10:51 GMT+0000 (Coordinated Universal Time),Wed Sep 06 2023 16:11:02 GMT+0000 (Coordinated Universal Time),"<h1 id="""">EHS Compliance: Navigating the Complex Landscape for EHS Directors</h1><h2 id="""">Introduction</h2><p id="""">Compliance is a cornerstone of effective Environment, Health, and Safety (EHS) management. For EHS Directors, navigating the intricate web of federal and state regulations, third-party prequalification systems, and client-specific requirements can be a daunting task. Our EHS Compliance services are designed to simplify this complex landscape, providing expert guidance and solutions tailored to your organization's needs. In this article, we explore how our EHS Compliance offerings can be a transformative asset for EHS Directors.</p><h2 id="""">Federal OSHA Compliance</h2><h3 id="""">Why It Matters</h3><p id="""">Compliance with Federal Occupational Safety and Health Administration (OSHA) regulations is mandatory for most organizations. Non-compliance can result in hefty fines, legal repercussions, and damage to your reputation.</p><h3 id="""">How Our EHS Compliance Helps</h3><p id="""">Our team of experts provides comprehensive guidance on Federal OSHA compliance, from hazard assessments to record-keeping. We help you navigate the complex regulatory landscape, ensuring that you meet all federal requirements.</p><h2 id="""">State OSHA Plans</h2><h3 id="""">Why It Matters</h3><p id="""">Some states have their own OSHA plans, which may include additional requirements beyond federal regulations. Understanding and complying with these state-specific rules is crucial.</p><h3 id="""">How Our EHS Compliance Helps</h3><p id="""">We offer specialized guidance on state OSHA plans, helping you understand the nuances and additional requirements that may apply to your organization. This ensures that you are compliant at both the federal and state levels.</p><h2 id="""">Third-Party Prequalification Systems: ISNetworld®, Avetta, Veriforce</h2><h3 id="""">Why It Matters</h3><p id="""">Many organizations require third-party prequalification through systems like ISNetworld®, Avetta, and Veriforce. These systems have their own set of requirements, which can be challenging to meet.</p><h3 id="""">How Our EHS Compliance Helps</h3><p id="""">Our services include assistance with third-party prequalification systems. We help you understand the specific requirements of each system and provide tailored solutions to ensure you meet them, streamlining the prequalification process.</p><h2 id="""">Insurance Requirements</h2><h3 id="""">Why It Matters</h3><p id="""">Insurance providers often have specific EHS requirements that organizations must meet to qualify for coverage or to benefit from lower premiums. Failure to meet these requirements can result in higher costs and limited coverage options.</p><h3 id="""">How Our EHS Compliance Helps</h3><p id="""">We offer expert guidance on meeting insurance requirements, from risk assessments to safety program development. This not only ensures compliance but can also result in cost savings through lower premiums.</p><h2 id="""">Client Requirements for the EHS Director</h2><h3 id="""">Why It Matters</h3><p id="""">In addition to regulatory and insurance requirements, EHS Directors often face client-specific EHS stipulations. These can vary widely and may include unique reporting protocols, safety standards, or training requirements.</p><h3 id="""">How Our EHS Compliance Helps</h3><p id="""">Our team works closely with you to understand your clients' specific EHS requirements. We then develop customized compliance strategies that meet these stipulations, ensuring that you can maintain strong client relationships without compromising on safety or compliance.</p><h2 id="""">Conclusion</h2><p id="""">EHS Compliance is not just a regulatory obligation; it's a complex landscape that requires specialized expertise and tailored solutions. Our EHS Compliance services offer EHS Directors a robust tool for navigating this landscape, from federal and state regulations to third-party prequalification systems and client-specific requirements. By leveraging our expertise, you can ensure that your organization is compliant, protected, and poised for success in the challenging world of EHS management.</p>","hsla(261, 100.00%, 50.00%, 1.00)","Lorem Ipsum is simply dummy text of the printing and typesetting industry. Lorem Ipsum has been the industry's standard dummy text ever since the 1500s, when an unknown printer took a galley of type and scrambled it to make a type specimen book.",false,
EHS Consulting,ehs-consulting,64f2b0ceb3c1ea886791b59b,64f2b0cd9c0d653c3c55ca45,64f3b2e1b31af272722b285d,Sat Sep 02 2023 22:10:41 GMT+0000 (Coordinated Universal Time),Tue Sep 05 2023 20:07:37 GMT+0000 (Coordinated Universal Time),Tue Sep 05 2023 20:47:26 GMT+0000 (Coordinated Universal Time),"<h1 id="""">EHS Consulting: Expert Guidance for EHS Directors Navigating Complex Challenges</h1><h2 id="""">Introduction</h2><p id="""">In the intricate world of Environment, Health, and Safety (EHS) management, the role of an EHS Director is multifaceted and demanding. From ensuring compliance with a myriad of regulations to fostering a culture of safety within the organization, the responsibilities are both critical and complex. Our EHS Consulting services are designed to provide expert guidance and tailored solutions to EHS Directors. In this article, we delve into how our EHS Consulting offerings can be a transformative asset for EHS Directors.</p><h2 id="""">Regulatory Compliance Advisory</h2><h3 id="""">Why It Matters</h3><p id="""">Staying compliant with ever-changing local, state, and federal regulations is a significant challenge. Non-compliance can result in hefty fines, legal repercussions, and damage to your organization's reputation.</p><h3 id="""">How Our EHS Consulting Helps</h3><p id="""">Our team of experts stays abreast of the latest regulatory changes and provides actionable advice on how to maintain compliance. We can help you navigate the complex regulatory landscape, ensuring that you meet all legal obligations.</p><h2 id="""">Risk Assessment and Mitigation</h2><h3 id="""">Why It Matters</h3><p id="""">Identifying potential risks and taking proactive measures to mitigate them is a cornerstone of effective EHS management. Traditional risk assessment methods can be time-consuming and may not capture all potential hazards.</p><h3 id="""">How Our EHS Consulting Helps</h3><p id="""">Our consultants specialize in advanced risk assessment techniques, providing a comprehensive analysis of potential hazards and recommending effective mitigation strategies. This enables EHS Directors to proactively address risks before they escalate into incidents.</p><h2 id="""">Incident Investigation and Root Cause Analysis</h2><h3 id="""">Why It Matters</h3><p id="""">When incidents do occur, it's crucial to understand the root causes to prevent future occurrences. However, incident investigation can be a complex and sensitive process.</p><h3 id="""">How Our EHS Consulting Helps</h3><p id="""">Our consultants are skilled in conducting thorough incident investigations and root cause analyses. We help you understand the underlying factors that led to the incident and provide recommendations for corrective actions.</p><h2 id="""">Policy Development and Review</h2><h3 id="""">Why It Matters</h3><p id="""">Effective EHS policies are the foundation of a robust EHS program. However, developing and reviewing these policies can be a daunting task.</p><h3 id="""">How Our EHS Consulting Helps</h3><p id="""">Our consultants can assist in the development and review of your EHS policies, ensuring they are both comprehensive and aligned with current best practices and regulations.</p><h2 id="""">Employee Training and Engagement</h2><h3 id="""">Why It Matters</h3><p id="""">Employee engagement is crucial for the success of any EHS program. However, developing effective training programs and engagement strategies can be challenging.</p><h3 id="""">How Our EHS Consulting Helps</h3><p id="""">We offer customized training programs and engagement strategies that resonate with your employees, ensuring that they are both well-informed and invested in your EHS initiatives.</p><h2 id="""">Conclusion</h2><p id="""">EHS Consulting is not just a service; it's a partnership aimed at enhancing your EHS performance. Our expert consultants provide tailored solutions that address the unique challenges and objectives of your organization. From regulatory compliance and risk assessment to incident investigation and employee engagement, our EHS Consulting services offer EHS Directors the expertise and support they need to excel in their roles. By leveraging our consulting services, you can navigate the complexities of EHS management with confidence and effectiveness.</p>","hsla(129, 100.00%, 50.00%, 1.00)","Lorem Ipsum is simply dummy text of the printing and typesetting industry. Lorem Ipsum has been the industry's standard dummy text ever since the 1500s, when an unknown printer took a galley of type and scrambled it to make a type specimen book.",false,
