Name,Slug,Collection ID,Locale ID,Item ID,Created On,Updated On,Published On,Body,Color,Excerpt,Featured Topic,Photo
AI/ML,machine-learning,64f2b0ceb3c1ea886791b59b,64f2b0cd9c0d653c3c55ca45,64f2c2fede2369f4a471d2fc,Sat Sep 02 2023 05:07:10 GMT+0000 (Coordinated Universal Time),Tue Apr 16 2024 03:32:33 GMT+0000 (Coordinated Universal Time),Tue Apr 16 2024 03:33:24 GMT+0000 (Coordinated Universal Time),"<h1 id="""">Artificial Intelligence and Machine Learning for Continuous EHS Improvement [Coming Soon]</h1><p id="""">Artificial Intelligence (AI) and Machine Learning (ML) are no longer a buzzwords; they are realities that are transforming various industries, including Environment, Health, and Safety (EHS). For EHS Directors, the advent of machine learning offers a plethora of opportunities to enhance safety protocols, ensure compliance, and make data-driven decisions. Dive into how our machine learning capabilities can be a transformative asset for EHS Directors.</p><h2 id="""">Predictive Analytics for Proactive Safety Measures</h2><h5 id="""">Why It Matters</h5><p id="""">Traditional EHS management often relies on reactive measures, responding to incidents after they occur. However, the goal is to prevent these incidents in the first place.</p><h5 id="""">How Our Machine Learning Helps</h5><p id="""">Our machine learning algorithms analyze historical data to predict potential future incidents, allowing EHS Directors to take proactive safety measures. Whether it's identifying machinery that's likely to fail soon or areas with a high risk of accidents, predictive analytics can be a lifesaver.</p><h2 id="""">Automated Compliance Monitoring</h2><h5 id="""">Why It Matters</h5><p id="""">Keeping up with ever-changing regulations and ensuring compliance is a significant challenge for EHS Directors. Non-compliance can result in hefty fines and damage to reputation.</p><h5 id="""">How Our Machine Learning Helps</h5><p id="""">Machine learning can automatically monitor compliance metrics and flag any deviations in real-time. This enables EHS Directors to address compliance issues promptly, reducing the risk of penalties and legal repercussions.</p><h2 id="""">Enhanced Risk Assessment</h2><h5 id="""">Why It Matters</h5><p id="""">Risk assessment is a cornerstone of EHS management. However, traditional risk assessment methods can be time-consuming and subjective.</p><h5 id="""">How Our Machine Learning Helps</h5><p id="""">Our machine learning algorithms can analyze a multitude of variables to assess risks accurately and objectively. This not only saves time but also provides EHS Directors with a comprehensive understanding of the risk landscape.</p><h2 id="""">Streamlined Incident Reporting and Investigation</h2><h5 id="""">Why It Matters</h5><p id="""">Accurate incident reporting and thorough investigation are crucial for improving safety measures. However, manual processes can be prone to errors and omissions.</p><h5 id="""">How Our Machine Learning Helps</h5><p id="""">Machine learning can automate the incident reporting process, ensuring that all relevant data is captured accurately. It can also assist in the investigation by identifying patterns and correlations that might be missed otherwise.</p><h2 id="""">Resource Optimization</h2><h5 id="""">Why It Matters</h5><p id="""">Optimizing resources is essential for both sustainability and cost-efficiency. EHS Directors often struggle with allocating resources effectively.</p><h5 id="""">How Our Machine Learning Helps</h5><p id="""">Machine learning can analyze resource utilization patterns to recommend optimization strategies. Whether it's reducing energy consumption or minimizing waste, machine learning provides actionable insights for resource optimization.</p><p id="""">Machine learning is not just a technological advancement; it's a paradigm shift in how EHS management can be approached. Our machine learning capabilities offer EHS Directors a robust tool for predictive analytics, automated compliance monitoring, enhanced risk assessment, streamlined incident reporting, and resource optimization. By embracing machine learning, EHS Directors can lead their organizations into a new era of safety and compliance.</p>","hsla(169, 100.00%, 50.00%, 1.00)","Lorem Ipsum is simply dummy text of the printing and typesetting industry. Lorem Ipsum has been the industry's standard dummy text ever since the 1500s, when an unknown printer took a galley of type and scrambled it to make a type specimen book.",false,
API,api,64f2b0ceb3c1ea886791b59b,64f2b0cd9c0d653c3c55ca45,64f54bf175a40718252e1da8,Mon Sep 04 2023 03:16:01 GMT+0000 (Coordinated Universal Time),Tue Apr 16 2024 03:33:08 GMT+0000 (Coordinated Universal Time),Tue Apr 16 2024 03:33:24 GMT+0000 (Coordinated Universal Time),"<h1 id="""">Empowering EHS Directors with Our API [Coming Soon]</h1><p id="""">In the complex landscape of Environment, Health, and Safety (EHS) management, the role of an EHS Director is pivotal. From ensuring compliance with ever-changing regulations to promoting a culture of safety within the organization, the responsibilities are vast and varied. Our cutting-edge API (Application Programming Interface) is designed to empower EHS Directors by offering seamless integration, real-time data access, and automation capabilities. Here's how our API can be a game-changer for EHS Directors.</p><h2 id="""">Seamless Integration with Existing Systems</h2><h5 id="""">Why It Matters</h5><p id="""">EHS Directors often work with a myriad of systems, including Project Management, Construction Management (<a href=""https://www.procore.com/"" target=""_blank"" id="""">Procore</a>), BIM, Human Resources, Supply Chain Management, and Enterprise Resource Planning (ERP) software. Managing data across these platforms can be cumbersome and time-consuming.</p><h5 id="""">How Our API Helps</h5><p id="""">Our API allows for effortless integration with your existing enterprise systems. This means you can pull data from various sources into your EHS platform without manual intervention, streamlining your workflow and ensuring data integrity.</p><h2 id="""">Real-Time Data Access for Informed Decision-Making</h2><h5 id="""">Why It Matters</h5><p id="""">In the world of EHS, timely information can be the difference between preventing an incident and reacting to one. EHS Directors need real-time data to make informed decisions.</p><h5 id="""">How Our API Helps</h5><p id="""">Our API facilitates real-time data exchange, enabling EHS Directors to have up-to-the-minute information on incidents, compliance statuses, and risk assessments. This empowers them to take immediate action when needed, enhancing the organization's safety and compliance measures.</p><h2 id="""">Automation of Routine Tasks</h2><h5 id="""">Why It Matters</h5><p id="""">EHS Directors are often bogged down with routine tasks like compliance tracking, incident reporting, and permit management, which can take away from their time spent on strategic initiatives.</p><h5 id="""">How Our API Helps</h5><p id="""">By automating these routine tasks, our API frees up valuable time for EHS Directors, allowing them to focus on more critical aspects like strategy development, employee training, and organizational change management.</p><h2 id="""">Enhanced Reporting and Analytics</h2><h5 id="""">Why It Matters</h5><p id="""">Effective EHS management relies on robust reporting and analytics. EHS Directors need to analyze trends, identify areas for improvement, and report findings to stakeholders.</p><h5 id="""">How Our API Helps</h5><p id="""">Our API enables advanced reporting features, allowing EHS Directors to generate customized reports and dashboards effortlessly. This makes it easier to track performance metrics, analyze trends, and present data-driven insights to stakeholders.</p>","hsla(22, 100.00%, 50.00%, 1.00)","Lorem Ipsum is simply dummy text of the printing and typesetting industry. Lorem Ipsum has been the industry's standard dummy text ever since the 1500s, when an unknown printer took a galley of type and scrambled it to make a type specimen book.",false,
Automating EHS,automating-ehs,64f2b0ceb3c1ea886791b59b,64f2b0cd9c0d653c3c55ca45,661394807d0c15e2507df9f8,Mon Apr 08 2024 06:53:52 GMT+0000 (Coordinated Universal Time),Mon Apr 08 2024 06:53:52 GMT+0000 (Coordinated Universal Time),Mon Apr 08 2024 06:55:08 GMT+0000 (Coordinated Universal Time),"<p id="""">In the dynamic landscape of Environmental, Health, and Safety (EHS) management, time is a precious commodity. Yet, too often, valuable hours are squandered on repetitive and redundant tasks that detract from more strategic endeavors. Enter the power of automation, a game-changer in streamlining EHS activities and empowering organizations to focus on what truly matters. Here's how our EHS software leverages automation to drive efficiency and excellence.</p><h3 id="""">Eliminating Repetitive Tasks: From Drudgery to Dynamism</h3><p id="""">Repetitive tasks are not just time-consuming; they're also mind-numbing. Our EHS software liberates you from the shackles of monotony by automating these mundane activities. Whether it's data entry, report generation, or compliance tracking, automation frees up your time and mental bandwidth, allowing you to redirect your energy towards more strategic initiatives.</p><h3 id="""">Maximizing Productivity: Your Most Important Work Takes Center Stage</h3><p id="""">In a world where every minute counts, maximizing productivity is essential. By automating repetitive and redundant EHS activities, our software enables you to focus on your most important work. Whether it's implementing proactive safety measures, analyzing trends to prevent incidents, or driving sustainability initiatives, automation ensures that your efforts are laser-focused and impactful.</p>",,,false,
Automation,automation,64f2b0ceb3c1ea886791b59b,64f2b0cd9c0d653c3c55ca45,64f2b12459342fcfbad67508,Sat Sep 02 2023 03:51:00 GMT+0000 (Coordinated Universal Time),Sun Feb 11 2024 04:00:51 GMT+0000 (Coordinated Universal Time),Sun Feb 11 2024 04:00:57 GMT+0000 (Coordinated Universal Time),"<h1 id="""">Transforming EHS Management with Process Automation</h1><h2 id="""">Introduction</h2><p id="""">In the ever-evolving landscape of Environment, Health, and Safety (EHS) management, the role of an EHS Director is becoming increasingly complex. With growing internal and external requirements, the need for more efficiency, and the pressure to improve operational KPIs, EHS Directors are looking for innovative solutions. Process automation stands out as a powerful tool that can significantly enhance EHS management processes.</p><h2 id="""">Streamlined Compliance Tracking</h2><h3 id="""">Why It Matters</h3><p id="""">Internal and external compliance is a critical aspect of EHS management, and failing to meet these requirements can result in negative outcomes. Manual correspondence and tracking of compliance metrics is not only time-consuming but also prone to errors.</p><h3 id="""">How Our Automations Help</h3><p id="""">Our automation capabilities eliminate the need for manual comms and tracking by automatically notifying and updating compliance statuses based on real-time data. This ensures that you're always in the know and can act swiftly to maintain compliance with your own internal requirements as well as external ones.</p><h2 id="""">Efficient Incident Reporting</h2><h3 id="""">Why It Matters</h3><p id="""">Timely and accurate incident reporting is crucial for both compliance and improving safety measures. Manual reporting processes can be cumbersome and may lead to delays or inaccuracies.</p><h3 id="""">How Our Automations Help</h3><p id="""">Automate the incident reporting process from start to finish. Our system captures all necessary details and generates reports, allowing EHS Directors to focus on implementing corrective actions rather than getting bogged down with paperwork.</p><h2 id="""">Proactive Risk Management</h2><h3 id="""">Why It Matters</h3><p id="""">Identifying and mitigating risks before they become incidents is a key responsibility for EHS Directors. Traditional risk assessment methods can be labor-intensive and may not capture all potential hazards.</p><h3 id="""">How Our Automations Help</h3><p id="""">Our automation features include advanced risk assessment tools that automatically analyze various data points to identify potential risks. This enables EHS Directors to take proactive measures to mitigate these risks effectively.</p><h2 id="""">Automated Training Programs</h2><h3 id="""">Why It Matters</h3><p id="""">Employee training is essential for maintaining a safe and compliant work environment. However, managing training schedules and tracking completion can be a logistical nightmare.</p><h3 id="""">How Our Automations Help</h3><p id="""">Our system automates the entire training process, from scheduling to tracking completion and generating compliance reports. This ensures that all employees are up-to-date with their training requirements, without the administrative hassle.</p><h2 id="""">Real-Time Analytics and Reporting</h2><h3 id="""">Why It Matters</h3><p id="""">Data-driven decision-making is crucial for effective EHS management. However, compiling and analyzing data manually is a time-consuming process that can delay important decisions.</p><h3 id="""">How Our Automations Help</h3><p id="""">Our automation capabilities include real-time analytics and reporting features. Generate custom reports, dashboards, and performance metrics at the click of a button, empowering you to make informed decisions quickly.</p><h2 id="""">Conclusion</h2><p id="""">Automation is not just a feature; it's a transformative approach to EHS management. By automating critical processes like compliance tracking, incident reporting, risk management, and employee training, EHS Directors can focus on strategic initiatives that drive safety and compliance to new heights. Our automation features are designed to make your role as an EHS Director more efficient, effective, and proactive.</p>","hsla(343, 100.00%, 50.00%, 1.00)","Lorem Ipsum is simply dummy text of the printing and typesetting industry. Lorem Ipsum has been the industry's standard dummy text ever since the 1500s, when an unknown printer took a galley of type and scrambled it to make a type specimen book.",false,
Contract/MSA Recovery,contract-msa,64f2b0ceb3c1ea886791b59b,64f2b0cd9c0d653c3c55ca45,64f3b3563a3dc9a344e8bb65,Sat Sep 02 2023 22:12:38 GMT+0000 (Coordinated Universal Time),Tue Sep 05 2023 20:21:38 GMT+0000 (Coordinated Universal Time),Tue Sep 05 2023 20:47:26 GMT+0000 (Coordinated Universal Time),"<h1 id="""">Contract/MSA Recovery Services: Turning the Tide for EHS Directors Facing Contractual Challenges</h1><h2 id="""">Introduction</h2><p id="""">Winning contracts and securing Master Service Agreements (MSAs) are critical for any organization's growth and sustainability. However, negative EHS or risk factors can be a significant roadblock, often leading to lost opportunities. Our Contract/MSA Recovery Services are designed to help EHS Directors overcome these challenges by creating compelling arguments that can turn the tide in their favor. In this article, we explore how our services can be a transformative asset for EHS Directors facing contractual challenges.</p><h2 id="""">Addressing Negative EHS or Risk Factors</h2><h3 id="""">Why It Matters</h3><p id="""">Negative EHS or risk factors can severely impact your organization's ability to secure contracts or MSAs. These factors can range from a high EMR/XMOD rate to past incidents or compliance issues.</p><h3 id="""">How Our Contract/MSA Recovery Services Help</h3><p id="""">Our team of experts will conduct a thorough analysis of the negative factors affecting your contract or MSA prospects. We then develop unique and compelling arguments that address these issues, showcasing your organization's commitment to improvement and risk mitigation.</p><h2 id="""">Strategic Argumentation</h2><h3 id="""">Why It Matters</h3><p id="""">When a contract or MSA is at stake, simply addressing negative factors may not be enough. You need to present a compelling case that not only mitigates concerns but also highlights your organization's strengths.</p><h3 id="""">How Our Contract/MSA Recovery Services Help</h3><p id="""">We specialize in creating strategic arguments that go beyond addressing negative factors. Our approach focuses on showcasing your organization's unique value propositions, from specialized expertise to a strong track record in EHS management.</p><h2 id="""">Navigating Contractual Requirements</h2><h3 id="""">Why It Matters</h3><p id="""">Contracts and MSAs often come with specific EHS and risk management requirements. Understanding and meeting these requirements is crucial for securing the contract.</p><h3 id="""">How Our Contract/MSA Recovery Services Help</h3><p id="""">Our team will help you navigate the complex contractual requirements, ensuring that your organization meets and exceeds them. This adds another layer of credibility to your case, making you a more attractive candidate for the contract or MSA.</p><h2 id="""">Tailored Solutions for Unique Challenges</h2><h3 id="""">Why It Matters</h3><p id="""">Every contract or MSA comes with its own set of challenges and requirements. A one-size-fits-all approach is unlikely to be effective.</p><h3 id="""">How Our Contract/MSA Recovery Services Help</h3><p id="""">We offer tailored solutions that are specifically designed to meet the unique challenges of each contract or MSA. Whether it's a specific compliance issue or a unique risk factor, we develop customized strategies to address them.</p><h2 id="""">Conclusion</h2><p id="""">Contract/MSA Recovery Services are not just a reactive measure; they're a proactive strategy for overcoming contractual challenges and securing critical business opportunities. Our services offer EHS Directors a robust tool for navigating the complex landscape of contracts and MSAs, from addressing negative EHS or risk factors to creating compelling, strategic arguments. By leveraging our expertise, you can turn potential roadblocks into stepping stones, securing contracts and MSAs that drive your organization's growth and success.</p>","hsla(69, 100.00%, 50.00%, 1.00)","Lorem Ipsum is simply dummy text of the printing and typesetting industry. Lorem Ipsum has been the industry's standard dummy text ever since the 1500s, when an unknown printer took a galley of type and scrambled it to make a type specimen book.",false,
Customizable EHS Software,customizable-ehs-software,64f2b0ceb3c1ea886791b59b,64f2b0cd9c0d653c3c55ca45,66139135f546d66fb24f31ca,Mon Apr 08 2024 06:39:49 GMT+0000 (Coordinated Universal Time),Mon Apr 08 2024 06:39:49 GMT+0000 (Coordinated Universal Time),Mon Apr 08 2024 06:55:08 GMT+0000 (Coordinated Universal Time),"<p id="""">In the realm of Environmental, Health, and Safety (EHS) management, one size rarely fits all. Each organization comes with its own set of unique requirements, challenges, and goals. Recognizing this diversity, we proudly present our EHS software, a versatile platform designed to be not just adaptable but customizable to suit your specific needs.</p><h3 id="""">Tailoring Solutions, Your Way</h3><p id="""">Our EHS software is not a rigid framework that forces you into a predefined mold. Instead, it offers you the freedom to mold it according to your requirements. Whether you prefer to use and extend our default system or opt to build your own from scratch, the power lies in your hands.</p><h3 id="""">Utilizing Default System: Flexibility at Your Fingertips</h3><p id="""">For those seeking quick implementation or embracing industry best practices, our default system serves as an excellent starting point. It's a robust foundation built upon years of experience and feedback from EHS professionals like yourself. You can effortlessly integrate it into your operations and start managing your EHS processes right away.</p><h3 id="""">Building from Scratch: Unleash Your Creativity</h3><p id="""">However, we understand that your organization might have unique workflows, compliance needs, or reporting structures. That's where the true customization prowess of our EHS software shines. With the ability to build your system from scratch, you're not just adapting the software – you're crafting a solution tailored precisely to your specifications.</p><h3 id="""">Platform Agnostic: Choose Your Playground</h3><p id="""">Flexibility is not limited to functionality alone; it extends to the very foundation of our software. You're not confined to a single platform; instead, you can choose the one that aligns best with your IT infrastructure and preferences. Whether it's leveraging your desired platform schema or utilizing our templates, the choice is yours.</p><h3 id="""">Templates: Jumpstart Your Customization Journey</h3><p id="""">Embarking on the customization journey can be daunting, which is why we offer a wide array of templates to kickstart your efforts. These templates are meticulously crafted based on industry standards and best practices, providing you with a solid starting point to build upon. From risk assessment matrices to incident reporting forms, we've got you covered.</p><h3 id="""">Empowering Endless Possibilities</h3><p id="""">Customization isn't just about tweaking existing features; it's about unlocking new possibilities. With our EHS software, you're not just configuring; you're innovating. Whether it's integrating with third-party tools, implementing advanced analytics, or creating bespoke dashboards, the only limit is your imagination.</p><p>‍</p>",,,false,
