Name,Slug,Collection ID,Locale ID,Item ID,Created On,Updated On,Published On,Body,Color,Excerpt,Featured Topic,Photo
Our White Label EHS Software/Services,white-label-ehs-software,64f2b0ceb3c1ea886791b59b,64f2b0cd9c0d653c3c55ca45,661aab70d34a0c16ec64fd75,Sat Apr 13 2024 15:57:36 GMT+0000 (Coordinated Universal Time),Sat Feb 22 2025 02:56:57 GMT+0000 (Coordinated Universal Time),Sat Feb 22 2025 02:56:57 GMT+0000 (Coordinated Universal Time),"<p id="""">Are you a Safety, HR, or other B2B Services company or consultant? If so, why not increase your revenue per customer by adding an EHS Software or Services business unit that offers much more? We can do all the heavy lifting while you stay focused on your core services.</p><p id="""">Today, differentiation and efficiency are key to outpacing competitors and securing a larger market share. For safety consultancies, insurance companies, HR firms, consultants and other organizations, offering unique value-added services can significantly enhance client satisfaction and revenue streams. That's where our Environmental, Health, and Safety (EHS) Software as a Service (SaaS) steps in, providing a golden opportunity to not only expand your service offering but also triple your revenue with minimal investment.</p><h2 id="""">What is White Labeling?</h2><p id="""">White labeling allows you to rebrand a product or service offered by another company (in this case, our state-of-the-art EHS software) and sell it as your own. This strategy enables you to offer additional services to your clients without the overheads associated with developing and maintaining the software yourself.</p><h2 id="""">Why Choose Our EHS SaaS for White Labeling?</h2><p id="""">Our EHS SaaS platform is designed with flexibility and user experience at its core. It helps organizations manage compliance, mitigate risks, and improve workplace health and safety efficiently. By choosing to white label our software, you can provide this top-tier solution to your clients under your own brand, enhancing your company’s profile and service offerings.</p><h2 id="""">Customization and Brand Integration (Coming Soon)</h2><p id="""">Our white label solution offers seamless customization options that allow you to integrate your own branding and identity. Your clients will interact with the software seeing your logo, color scheme, and corporate identity, not ours. This level of personalization helps strengthen your brand’s presence and loyalty among your clients.</p><h2 id="""">Two Flexible White Labeling Options</h2><p id="""">1. **Software Only:** You can choose to white label our software and handle all client management and interactions independently. This option is perfect for organizations that already have the structure to manage client accounts but require an advanced software solution to complete their service portfolio.</p><p id="""">2. **Software + Managed Services:** For those who prefer to focus on core business operations, this option allows you to white label our software while we take care of the account management. We become ""your""&nbsp;EHS&nbsp;department under your brand. Our expert team will handle all operational aspects under your client accounts, ensuring that your clients receive top-quality service without any additional workload on your side.</p><h2 id="""">Benefits of Our White Label EHS SaaS</h2><p id="""">- **Enhanced Service Offering:** Instantly broaden your service portfolio with a sophisticated EHS solution that meets a wide range of client needs.<br>- **Cost-Effective:** Avoid the high costs and risks associated with developing your own software. Our ready-to-deploy solution means quick implementation and no development cost, translating into faster ROI.<br>- **Increased Revenue Streams:** With minimal initial investment, the potential to triple your revenue becomes accessible. Our competitive pricing structures and premium service options ensure that you can offer a cost-effective solution to your clients while maximizing your profit margins.<br>- **Expert Support:** Our dedicated support team ensures that both you and your clients have continuous access to technical and customer support, ensuring high satisfaction and retention rates.</p><h2 id="""">Realize the Potential</h2><p id="""">Imagine providing a necessary, compliance-driven service that not only enhances your client’s operational safety but also fortifies your company’s market position. With our white label EHS software, you’re not just purchasing a product; you’re embracing an opportunity to significantly expand your business with continual support from a dedicated partner.</p><p id="""">Don’t let this chance slip by. If you’re looking to elevate your business, diversify your offerings, and significantly increase your revenue with little to no upfront cost, our white label EHS SaaS is the solution you need. Contact us today to find out how our software can be the key to your company's enhanced profitability and success.</p>",,,false,
Outsourcing,outsourcing,64f2b0ceb3c1ea886791b59b,64f2b0cd9c0d653c3c55ca45,64f2c31f7503071590ae2f6d,Sat Sep 02 2023 05:07:43 GMT+0000 (Coordinated Universal Time),Tue Sep 05 2023 20:06:15 GMT+0000 (Coordinated Universal Time),Tue Sep 05 2023 20:47:26 GMT+0000 (Coordinated Universal Time),"<h1 id="""">EHS Outsourcing: A Comprehensive Solution for EHS Directors</h1><h2 id="""">Introduction</h2><p id="""">Managing Environment, Health, and Safety (EHS) is a complex task that requires specialized knowledge, resources, and continuous effort. For EHS Directors, juggling these responsibilities alongside other organizational duties can be overwhelming. This is where EHS Outsourcing comes into play. Our comprehensive outsourcing solutions cover a wide range of EHS services, from training and consulting to prequalification services and recovery efforts. In this article, we explore how our EHS Outsourcing offerings can be a game-changer for EHS Directors.</p><h2 id="""">Comprehensive EHS Training</h2><h3 id="""">Why It Matters</h3><p id="""">Effective EHS training is crucial for ensuring employee safety and regulatory compliance. However, developing and managing training programs can be time-consuming and costly.</p><h3 id="""">How Our EHS Outsourcing Helps</h3><p id="""">We offer a full suite of EHS training programs that are both engaging and compliant with industry standards. By outsourcing your training needs to us, you can ensure high-quality education without the administrative burden.</p><h2 id="""">Expert EHS Consulting</h2><h3 id="""">Why It Matters</h3><p id="""">Navigating the complexities of EHS regulations and best practices requires specialized expertise. Mistakes can lead to non-compliance, legal issues, and safety hazards.</p><h3 id="""">How Our EHS Outsourcing Helps</h3><p id="""">Our team of certified EHS consultants can provide expert guidance on all aspects of EHS management. From risk assessments to policy development, we've got you covered.</p><h2 id="""">Streamlined Prequalification Services</h2><h3 id="""">Why It Matters</h3><p id="""">Vendor and contractor prequalification is essential for mitigating risks and ensuring compliance. However, the prequalification process can be cumbersome and resource-intensive.</p><h3 id="""">How Our EHS Outsourcing Helps</h3><p id="""">We handle the entire prequalification process for you, from gathering documentation to assessing compliance and risk factors. This ensures that you only engage with vendors and contractors who meet your EHS standards.</p><h2 id="""">Efficient EMR/XMOD Recovery</h2><h3 id="""">Why It Matters</h3><p id="""">A high Experience Modification Rate (EMR) or XMOD factor can significantly increase your workers' compensation costs. Recovery efforts require specialized knowledge and resources.</p><h3 id="""">How Our EHS Outsourcing Helps</h3><p id="""">Our EMR/XMOD recovery services include a thorough analysis of your claims history and the implementation of strategies to reduce your rates, ultimately saving you money.</p><h2 id="""">Contract/MSA Recovery</h2><h3 id="""">Why It Matters</h3><p id="""">Managing contracts and Master Service Agreements (MSAs) is crucial for ensuring compliance and mitigating risks. However, it can be challenging to keep track of all contractual obligations.</p><h3 id="""">How Our EHS Outsourcing Helps</h3><p id="""">We offer Contract/MSA Recovery services that help you manage, optimize, and even renegotiate your contracts, ensuring that you meet all your obligations while minimizing risks.</p><h2 id="""">Conclusion</h2><p id="""">EHS Outsourcing is not just a service; it's a strategic partnership that allows EHS Directors to focus on their core responsibilities while ensuring the highest standards of safety and compliance. Our comprehensive outsourcing solutions offer a one-stop-shop for all your EHS needs, from training and consulting to specialized recovery services. By leveraging our expertise, you can enhance your EHS performance while optimizing resources and reducing costs.</p>","hsla(214, 100.00%, 50.00%, 1.00)","Lorem Ipsum is simply dummy text of the printing and typesetting industry. Lorem Ipsum has been the industry's standard dummy text ever since the 1500s, when an unknown printer took a galley of type and scrambled it to make a type specimen book.",false,
Participate,participate,64f2b0ceb3c1ea886791b59b,64f2b0cd9c0d653c3c55ca45,64f79620862a1883b03a3f64,Tue Sep 05 2023 20:57:04 GMT+0000 (Coordinated Universal Time),Tue Sep 05 2023 20:57:04 GMT+0000 (Coordinated Universal Time),Tue Sep 05 2023 21:01:57 GMT+0000 (Coordinated Universal Time),"<h1 id="""">Participate in Shaping the Future of EHS Management with EHS, Inc.</h1><h2 id="""">Introduction</h2><p id="""">At EHS, Inc., we believe that the best solutions come from those who use them every day. That's why we're inviting EHS Directors like you to participate in shaping the future of our EHS management platform. We understand that off-the-shelf EHS software often falls short of meeting your unique needs and challenges. Here's your chance to guide our development process and finally get the EHS solution you've always wanted.</p><h2 id="""">The Problem with Off-The-Shelf Solutions</h2><p id="""">We've heard it time and time again—the biggest complaint from EHS Directors is that existing EHS software applications don't fully meet their needs. Whether it's limited customization options, lack of specific features, or cumbersome user interfaces, off-the-shelf solutions often leave much to be desired.</p><h2 id="""">Your Voice, Your Platform</h2><p id="""">We're changing the game by inviting you to have a say in what we build and deploy. By participating in our development process, you can ensure that the platform is tailored to meet the specific needs and challenges that EHS Directors face. This is your opportunity to influence the features, usability, and overall functionality of a platform designed for EHS professionals, by EHS professionals.</p><h2 id="""">How It Works</h2><ol id=""""><li id=""""><strong id="""">Sign Up</strong>: Register to participate and provide input into our development process.</li><li id=""""><strong id="""">Share Your Insights</strong>: Tell us what features you need, what challenges you face, and how you envision the ideal EHS platform.</li><li id=""""><strong id="""">Test the Platform</strong>: Once the features are developed, you'll get the chance to test them out in a real-world setting.</li></ol><h2 id="""">Exclusive Benefits for Participants</h2><p id="""">As a token of our appreciation for your invaluable input, all participants will receive:</p><ul id=""""><li id=""""><strong id="""">Three Months of Free Testing</strong>: Experience the platform's capabilities without any financial commitment.</li><li id=""""><strong id="""">No Obligation to Sign Up</strong>: After the testing period, it's entirely up to you whether you wish to continue using our platform.</li><li id=""""><strong id="""">First Access to New Features</strong>: Be the first to try out new features and improvements based on your feedback.</li></ul><h2 id="""">Conclusion</h2><p id="""">Your expertise as an EHS Director is crucial in helping us create a platform that truly meets the needs of EHS professionals. By participating in our development process, you're not just shaping our platform—you're shaping the future of EHS management. Join us in this exciting journey and take advantage of three months of free testing with no obligation to sign up. Together, we can build the EHS solution you've always wanted.</p>","hsla(22, 100.00%, 50.00%, 1.00)","Lorem Ipsum is simply dummy text of the printing and typesetting industry. Lorem Ipsum has been the industry's standard dummy text ever since the 1500s, when an unknown printer took a galley of type and scrambled it to make a type specimen book.",false,
Partnerships,partnerships,64f2b0ceb3c1ea886791b59b,64f2b0cd9c0d653c3c55ca45,64f796d84deda43045ec53a5,Tue Sep 05 2023 21:00:08 GMT+0000 (Coordinated Universal Time),Tue Sep 05 2023 21:00:08 GMT+0000 (Coordinated Universal Time),Tue Sep 05 2023 21:01:57 GMT+0000 (Coordinated Universal Time),"<h1 id="""">Elevate Your Consultancy with EHS, Inc.'s Partnership Program</h1><h2 id="""">Introduction</h2><p id="""">Welcome to the EHS, Inc. Partnership Program—a unique opportunity for EHS, HR, and other consultants to join forces with us in a profit-sharing arrangement. We understand that managing client relationships and software can be a time-consuming endeavor that distracts from your core consulting activities. Our program is designed to alleviate these challenges, allowing you to focus on what you do best: providing expert consulting services.</p><h2 id="""">The Challenge Consultants Face</h2><p id="""">Consultants often find themselves juggling multiple roles—from business development and client management to the actual consulting work. This leaves little time for focusing on growing the business and delivering high-value, in-person consulting services.</p><h2 id="""">The EHS, Inc. Solution</h2><p id="""">Our Partnership Program aims to simplify this complex landscape. We provide the platform and manage your clientele for you, freeing up your time and resources to focus on in-person consulting and business growth.</p><h3 id="""">How It Works</h3><ol id=""""><li id=""""><strong id="""">Join the Program</strong>: Sign up for our Partnership Program and gain access to our cutting-edge EHS platform.</li><li id=""""><strong id="""">Client Management</strong>: We handle the client management aspect, from onboarding to ongoing support, using our platform.</li><li id=""""><strong id="""">You Consult</strong>: With client management taken care of, you can focus on delivering your expert consulting services.</li><li id=""""><strong id="""">Profit Sharing</strong>: Enjoy a share of the profits generated from clients managed through our platform.</li></ol><h2 id="""">Key Benefits</h2><ul id=""""><li id=""""><strong id="""">Streamlined Operations</strong>: No need to worry about software or client management—we've got it covered.</li><li id=""""><strong id="""">Increased Focus</strong>: Spend more time on in-person consulting, training, and other high-value activities.</li><li id=""""><strong id="""">Business Growth</strong>: With the operational aspects handled, you can focus on expanding your client base.</li><li id=""""><strong id="""">Shared Profits</strong>: Benefit from a mutually beneficial profit-sharing arrangement.</li></ul><h2 id="""">Who Can Benefit?</h2><ul id=""""><li id=""""><strong id="""">EHS Consultants</strong>: Enhance your consultancy by offering a comprehensive EHS platform to your clients.</li><li id=""""><strong id="""">HR Consultants</strong>: Streamline HR management for your clients while focusing on strategic HR consulting.</li><li id=""""><strong id="""">Other Consultants</strong>: If you're in a field that could benefit from streamlined client management and a robust platform, we'd love to partner with you.</li></ul><h2 id="""">Conclusion</h2><p id="""">The EHS, Inc. Partnership Program offers a win-win solution for consultants looking to grow their business without the operational headaches. By partnering with us, you can focus on delivering exceptional consulting services while enjoying a share of the profits. It's time to elevate your consultancy to the next level. Join our Partnership Program today and discover the benefits of a truly symbiotic relationship.</p>","hsla(22, 100.00%, 50.00%, 1.00)","Lorem Ipsum is simply dummy text of the printing and typesetting industry. Lorem Ipsum has been the industry's standard dummy text ever since the 1500s, when an unknown printer took a galley of type and scrambled it to make a type specimen book.",false,
Prequalification,prequalification,64f2b0ceb3c1ea886791b59b,64f2b0cd9c0d653c3c55ca45,64f3b32eb31af272722b5874,Sat Sep 02 2023 22:11:58 GMT+0000 (Coordinated Universal Time),Tue Sep 05 2023 20:15:17 GMT+0000 (Coordinated Universal Time),Tue Sep 05 2023 20:47:26 GMT+0000 (Coordinated Universal Time),"<h1 id="""">EHS Prequalification Services: Streamlining the Process for Overwhelmed EHS Directors</h1><h2 id="""">Introduction</h2><p id="""">Prequalification is an essential but often cumbersome aspect of Environment, Health, and Safety (EHS) management. For EHS Directors, navigating the maze of third-party prequalification systems like ISNetworld®, Avetta, Veriforce, RigUp, and Gold Shovel can be a time-consuming and frustrating experience. Our EHS Prequalification Services are designed to alleviate this burden, allowing EHS Directors to focus on more strategic aspects of their role. In this article, we delve into how our services can simplify the prequalification process for EHS Directors.</p><h2 id="""">Navigating Multiple Prequalification Systems</h2><h3 id="""">Why It Matters</h3><p id="""">Each third-party prequalification system has its own set of requirements, documentation, and evaluation criteria. Managing multiple systems simultaneously can be overwhelming for EHS Directors.</p><h3 id="""">How Our EHS Prequalification Services Help</h3><p id="""">We offer a one-stop solution for all your prequalification needs. Our experts are well-versed in the requirements of various systems, from ISNetworld® and Avetta to Veriforce and RigUp. We handle the entire process for you, ensuring that you meet the criteria for each system.</p><h2 id="""">Time-Saving Solutions</h2><h3 id="""">Why It Matters</h3><p id="""">Time is a precious resource for EHS Directors, who often juggle multiple responsibilities. The administrative burden of prequalification can divert attention from more critical tasks like safety management and compliance.</p><h3 id="""">How Our EHS Prequalification Services Help</h3><p id="""">Our services are designed to save you time by taking care of all the administrative tasks involved in prequalification. From gathering required documentation to filling out forms and submitting applications, we handle it all.</p><h2 id="""">Expert Guidance on Meeting Criteria</h2><h3 id="""">Why It Matters</h3><p id="""">Failure to meet the criteria of prequalification systems can result in lost business opportunities and could even impact your organization's reputation.</p><h3 id="""">How Our EHS Prequalification Services Help</h3><p id="""">Our team of experts provides tailored guidance on how to meet the specific criteria of each prequalification system. We help you understand what is required and how to present your organization in the best possible light.</p><h2 id="""">Gold Shovel and Specialized Systems</h2><h3 id="""">Why It Matters</h3><p id="""">Some industries have specialized prequalification systems, like Gold Shovel, which focuses on reducing utility strikes. Understanding and meeting these specialized requirements can be particularly challenging.</p><h3 id="""">How Our EHS Prequalification Services Help</h3><p id="""">We offer specialized guidance for niche prequalification systems like Gold Shovel. Our experts understand the unique requirements of these systems and can help you navigate them successfully.</p><h2 id="""">Conclusion</h2><p id="""">EHS Prequalification Services are not just an administrative necessity; they're a strategic tool that allows EHS Directors to focus on what truly matters—ensuring a safe and compliant work environment. Our services simplify the complex and time-consuming process of prequalification, from navigating multiple systems to meeting specialized criteria. By leveraging our expertise, EHS Directors can free themselves from the administrative red tape and devote their time to more impactful aspects of EHS management.</p>","hsla(222, 100.00%, 50.00%, 1.00)","Lorem Ipsum is simply dummy text of the printing and typesetting industry. Lorem Ipsum has been the industry's standard dummy text ever since the 1500s, when an unknown printer took a galley of type and scrambled it to make a type specimen book.",false,
Streamlining and Consolidating EHS Tools,streamlining-and-consolidating-ehs-tools,64f2b0ceb3c1ea886791b59b,64f2b0cd9c0d653c3c55ca45,6613921a9ad17a69dec92d47,Mon Apr 08 2024 06:43:38 GMT+0000 (Coordinated Universal Time),Mon Apr 08 2024 06:43:38 GMT+0000 (Coordinated Universal Time),Mon Apr 08 2024 06:55:08 GMT+0000 (Coordinated Universal Time),"<p id="""">In today's fast-paced business landscape, efficiency is paramount. Yet, many organizations find themselves bogged down by a myriad of disparate software tools, each serving a specific purpose. Enter our Unified EHS Platform, designed to streamline your operations by consolidating your current tech stack into a single, cohesive solution.</p><h3 id="""">Simplifying Complexity: From Fragmented Tools to Unified Platform</h3><p id="""">Managing Environmental, Health, and Safety (EHS) processes often involves juggling multiple software applications, each with its own interface, data format, and user experience. This fragmentation not only leads to inefficiencies but also increases the risk of data discrepancies and errors. Our Unified EHS Platform aims to simplify this complexity by bringing together all your EHS functionalities under one roof.</p><h3 id="""">Unifying Data: Where Clarity Reigns Supreme</h3><p id="""">One of the biggest challenges with using multiple software tools is the confusion that arises from disparate data sources. With our Unified EHS Platform, say goodbye to data silos and conflicting information. By consolidating all your EHS data onto a single platform, you gain a holistic view of your organization's performance, compliance status, and risk profile. Clarity replaces confusion, empowering you to make informed decisions with confidence.</p>",,,false,
