Name,Slug,Collection ID,Locale ID,Item ID,Created On,Updated On,Published On,Body,Color,Excerpt,Featured Topic,Photo
EHS Consutlant,ehs-consutlant,64f2b0ceb3c1ea886791b59b,64f2b0cd9c0d653c3c55ca45,64f54c746ef461a95e6b81ae,Mon Sep 04 2023 03:18:12 GMT+0000 (Coordinated Universal Time),Mon Sep 02 2024 02:31:04 GMT+0000 (Coordinated Universal Time),Mon Sep 02 2024 02:31:04 GMT+0000 (Coordinated Universal Time),"<h1 id="""">Supercharging Your EHS Consultancy: The Competitive Edge Our Solution Offers to EHS Consultants</h1><h2 id="""">Introduction</h2><p id="""">EHS Consultants occupy a unique space in the realm of Environment, Health, and Safety management. Unlike EHS Directors who focus on a single organization, EHS Consultants manage EHS for multiple companies, often as an outside third party. This presents its own set of challenges and opportunities. Our groundbreaking EHS solution is designed to revolutionize the way EHS Consultants operate, allowing them to offer 4x the value with less work.</p><h2 id="""">Offer 4x the Value, with Half the Effort</h2><h3 id="""">Why It Matters to EHS Consultants</h3><p id="""">EHS Consultants are often stretched thin, managing multiple clients and juggling various tasks. The ability to offer more value without increasing workload is a game-changer.</p><h3 id="""">How Our Solution Helps</h3><p id="""">Our EHS solution automates many of the routine tasks that take up a consultant's time, from compliance tracking to risk assessment. This automation allows you to focus on high-value activities like strategic planning and client engagement, effectively allowing you to offer 4x the value with less work.</p><h2 id="""">Charge More, Work Less</h2><h3 id="""">Why It Matters to EHS Consultants</h3><p id="""">In a competitive market, the ability to offer superior value allows you to command higher fees. At the same time, reducing your workload enables you to take on more clients or enjoy more free time.</p><h3 id="""">How Our Solution Helps</h3><p id="""">By streamlining and automating many EHS tasks, our solution enables you to deliver exceptional value to your clients. This not only justifies higher fees but also frees up your time, allowing you to grow your client base or achieve a better work-life balance.</p><h2 id="""">Outpace the Competition</h2><h3 id="""">Why It Matters to EHS Consultants</h3><p id="""">In a crowded market, standing out is crucial. Offering unique, high-value services can set you apart from the competition.</p><h3 id="""">How Our Solution Helps</h3><p id="""">Our solution's robust features and customization options allow you to offer tailored EHS solutions that your competitors can't match. This unique selling point can be a significant advantage in attracting and retaining clients.</p><h2 id="""">Scalability for Business Growth</h2><h3 id="""">Why It Matters to EHS Consultants</h3><p id="""">As your consultancy grows, you'll need tools that can scale with you. Managing multiple clients requires a platform that is both robust and flexible.</p><h3 id="""">How Our Solution Helps</h3><p id="""">Our EHS solution is designed for scalability, allowing you to easily add new clients and services as your business grows. The platform's automation and data analytics capabilities also make it easier to manage multiple clients efficiently, setting the stage for rapid business expansion.</p><h2 id="""">Conclusion</h2><p id="""">EHS Consultants face a unique set of challenges and opportunities. Our advanced EHS Platform is engineered to turn these challenges into advantages, offering a pathway to significantly increased value, higher fees, and business growth. By leveraging the capabilities of our platform, EHS Consultants can redefine their value proposition, outpace the competition, and set their business on a trajectory for unprecedented success.</p>","hsla(22, 100.00%, 50.00%, 1.00)","Lorem Ipsum is simply dummy text of the printing and typesetting industry. Lorem Ipsum has been the industry's standard dummy text ever since the 1500s, when an unknown printer took a galley of type and scrambled it to make a type specimen book.",false,
EHS Director,ehs-director,64f2b0ceb3c1ea886791b59b,64f2b0cd9c0d653c3c55ca45,64f54c0630541c2170460eb2,Mon Sep 04 2023 03:16:22 GMT+0000 (Coordinated Universal Time),Thu Oct 12 2023 19:37:26 GMT+0000 (Coordinated Universal Time),Thu Oct 12 2023 19:45:24 GMT+0000 (Coordinated Universal Time),"<h1 id="""">Empowering EHS Directors with Our Revolutionary EHS Solution</h1><h2 id="""">Introduction</h2><p id="""">The role of an Environment, Health, and Safety (EHS) Director is multifaceted and demanding, encompassing everything from compliance and training to risk management and operational efficiency. Traditional EHS tools often fall short, forcing EHS Directors to juggle multiple solutions. Our revolutionary EHS Platform is designed to address this gap, offering a comprehensive, customizable, and integrated solution tailored to the unique needs of EHS Directors. In this article, we delve into how our platform can be a game-changer for those in this critical role.</p><h2 id="""">Limitless Customization for Unique Needs</h2><h3 id="""">Why It Matters to EHS Directors</h3><p id="""">Every organization has its own set of EHS challenges and requirements. Off-the-shelf software solutions often lack the flexibility to meet these specific needs, leading to inefficiencies and gaps in EHS management.</p><h3 id="""">How Our Solution Helps</h3><p id="""">Our EHS solution allows EHS Directors to create whatever EHS tools they want, with no limits. Whether you need specialized risk assessment modules or unique compliance tracking systems, our platform lets you build it, ensuring a tailored fit for your organization's needs.</p><h2 id="""">One Infrastructure, Multiple Solutions</h2><h3 id="""">Why It Matters to EHS Directors</h3><p id="""">Managing multiple software tools for different EHS functions can be cumbersome and inefficient. It also increases the risk of data silos and inconsistencies.</p><h3 id="""">How Our Solution Helps</h3><p id="""">Our solution serves as a one-stop solution, allowing EHS Directors to replace multiple tools with a single, integrated platform. This ensures seamless data management and streamlined operations, freeing up time for strategic initiatives.</p><h2 id="""">Seamless Integration for Comprehensive Analysis</h2><h3 id="""">Why It Matters to EHS Directors</h3><p id="""">In today's interconnected world, EHS data often needs to sync with other enterprise systems like Procore, Microsoft Power BI, and Salesforce for comprehensive analysis and decision-making.</p><h3 id="""">How Our Solution Helps</h3><p id="""">Our solution offers robust integration capabilities, allowing you to sync your EHS data with other services seamlessly. This enables more comprehensive data analysis and better-informed decision-making, enhancing your strategic capabilities.</p><h2 id="""">Automation for Operational Efficiency</h2><h3 id="""">Why It Matters to EHS Directors</h3><p id="""">Manual EHS processes can be time-consuming and prone to errors, leading to increased operational costs and compliance risks.</p><h3 id="""">How Our Solution Helps</h3><p id="""">Our solution allows you to create powerful automations that can save your company hundreds of thousands of dollars per year, or even millions. From automated compliance checks to incident reporting, the possibilities are endless, allowing you to focus on higher-level tasks.</p><h2 id="""">Unique Subcontractor Management</h2><h3 id="""">Why It Matters to EHS Directors</h3><p id="""">Managing subcontractors in EHS is often a complex and challenging task, requiring specialized solutions.</p><h3 id="""">How Our Solution Helps</h3><p id="""">Our platform has the unique ability to deal with subcontractors in a very unusual and novel way. Whether it's specialized prequalification processes or unique compliance tracking, our platform offers tailored solutions for subcontractor management, simplifying this often complicated aspect of EHS management.</p><h2 id="""">Conclusion</h2><p id="""">Being an EHS Director is a challenging role that requires a multifaceted approach to management. Our revolutionary EHS Platform is designed to empower EHS Directors, providing them with the tools, customization, and integrations they need to excel in their roles. By leveraging the capabilities of our platform, EHS Directors can achieve unparalleled levels of safety, compliance, and operational efficiency, all from a single, integrated solution.</p>","hsla(22, 100.00%, 50.00%, 1.00)","Lorem Ipsum is simply dummy text of the printing and typesetting industry. Lorem Ipsum has been the industry's standard dummy text ever since the 1500s, when an unknown printer took a galley of type and scrambled it to make a type specimen book.",false,
EHS Manager,ehs-manager,64f2b0ceb3c1ea886791b59b,64f2b0cd9c0d653c3c55ca45,64f54c146ef461a95e6b1676,Mon Sep 04 2023 03:16:36 GMT+0000 (Coordinated Universal Time),Thu Oct 12 2023 19:38:52 GMT+0000 (Coordinated Universal Time),Thu Oct 12 2023 19:45:24 GMT+0000 (Coordinated Universal Time),"<h1 id="""">Transforming Field Operations for EHS Managers with Our Cutting-Edge EHS Solution</h1><h2 id="""">Introduction</h2><p id="""">EHS Managers are the boots-on-the-ground force responsible for implementing and overseeing Environment, Health, and Safety (EHS) initiatives in the field. Unlike EHS Directors who often focus on strategic planning, EHS Managers need tools that are quick, accessible, and flexible to adapt to real-world conditions. Our state-of-the-art EHS Solution is engineered to meet these specific needs, offering a paperless, efficient, and highly customizable solution.</p><h2 id="""">Go Paperless, Go Efficient</h2><h3 id="""">Why It Matters to EHS Managers</h3><p id="""">Fieldwork often involves cumbersome paperwork, from safety checklists to incident reports. Managing these documents can be time-consuming and prone to errors.</p><h3 id="""">How Our Solution Helps</h3><p id="""">Our EHS solution offers a completely paperless solution, allowing EHS Managers to handle all EHS activities digitally. This not only reduces the risk of errors but also speeds up the entire process, making field operations more efficient.</p><h2 id="""">Quick Actions for Fast-Paced Environments</h2><h3 id="""">Why It Matters to EHS Managers</h3><p id="""">In the field, situations can change rapidly, requiring quick decisions and actions. Traditional EHS tools can be slow and cumbersome, hindering the ability to respond effectively.</p><h3 id="""">How Our Solution Helps</h3><p id="""">Our solution is designed for speed and ease of use, allowing EHS Managers to perform EHS activities quickly. Whether it's conducting a risk assessment or reporting an incident, our platform enables rapid action, ensuring timely and effective EHS management.</p><h2 id="""">Delegate with Confidence</h2><h3 id="""">Why It Matters to EHS Managers</h3><p id="""">EHS Managers often interact with subcontractors and other personnel, requiring a level of delegation for certain tasks. However, delegation can be risky if not managed properly.</p><h3 id="""">How Our Solution Helps</h3><p id="""">Our solution offers unique features for subcontractor management, allowing EHS Managers to delegate tasks with confidence. You can assign specific roles and permissions, ensuring that subcontractors or other personnel can only access the information and tools relevant to their tasks.</p><h2 id="""">Customizable for Your Specific Needs</h2><h3 id="""">Why It Matters to EHS Managers</h3><p id="""">Every field operation is unique, requiring customized solutions for different tasks, locations, and teams.</p><h3 id="""">How Our Solution Helps</h3><p id="""">Our solution allows EHS Managers to create customized EHS tools tailored to their specific field needs. This ensures that you have the right tools at your fingertips, enhancing your effectiveness in the field.</p><h2 id="""">Conclusion</h2><p id="""">EHS Managers are the frontline warriors in the battle for a safer and more compliant work environment. Our cutting-edge EHS Platform is designed to empower EHS Managers, offering them a paperless, quick, and customizable solution for their unique challenges. By leveraging the capabilities of our platform, EHS Managers can transform their field operations, achieving unparalleled levels of efficiency, safety, and compliance.</p>","hsla(22, 100.00%, 50.00%, 1.00)","Lorem Ipsum is simply dummy text of the printing and typesetting industry. Lorem Ipsum has been the industry's standard dummy text ever since the 1500s, when an unknown printer took a galley of type and scrambled it to make a type specimen book.",false,
EHS Services,ehs-services,64f2b0ceb3c1ea886791b59b,64f2b0cd9c0d653c3c55ca45,64f3b3e15cb2cbb83742ae36,Sat Sep 02 2023 22:14:57 GMT+0000 (Coordinated Universal Time),Tue Oct 31 2023 18:28:12 GMT+0000 (Coordinated Universal Time),Tue Oct 31 2023 18:28:17 GMT+0000 (Coordinated Universal Time),"<h1 id="""">Comprehensive EHS Services: We Can Be Your EHS Support Team</h1><h2 id="""">Introduction</h2><p id="""">In the complex world of Environment, Health, and Safety (EHS) management, EHS Directors face a multitude of challenges that require specialized expertise and a diverse set of tools. Our Comprehensive EHS Services offer a one-stop solution that covers every facet of EHS management, from training and consulting to compliance and specialized recovery services. In this article, we explore how our all-encompassing EHS services can be a transformative asset for EHS Directors.</p><h2 id="""">EHS Administration</h2><h3 id="""">Why It Matters</h3><p id="""">EHS&nbsp;Directors claim that they are bogged down by a wide range of administrative duties which distract their teams from the important work.</p><h3 id="""">How Our EHS&nbsp;Admin Services Help</h3><p id="""">Our administrative services allow you to offload work that interferes with your team's most important tasks so they can increase focus and get a better result for your department.</p><h2 id="""">EHS Training</h2><h3 id="""">Why It Matters</h3><p id="""">Effective training is the cornerstone of any successful EHS program. It ensures employee safety and helps organizations have an educated and informed workforce.</p><h3 id="""">How Our EHS&nbsp;Training Services Help</h3><p id="""">Our EHS Training services offer a wide range of programs, including specialized courses like OSHA 10 and 30-hour training, First Aid, CPR, and Fall Protection. These programs are designed to meet the diverse training needs of your organization.</p><h2 id="""">EHS Consulting</h2><h3 id="""">Why It Matters</h3><p id="""">Navigating the complexities of EHS regulations and best practices requires specialized expertise. Mistakes can lead to non-compliance, legal issues, and safety hazards.</p><h3 id="""">How Our EHS&nbsp;Consulting Services Help</h3><p id="""">Our EHS Consulting services provide expert guidance on all aspects of EHS management. From risk assessments to policy development, we offer tailored solutions that address your unique challenges.</p><h2 id="""">EHS Compliance</h2><h3 id="""">Why It Matters</h3><p id="""">Compliance with federal and state regulations, as well as third-party systems like ISNetworld, Avetta, and Veriforce, is crucial for both legal and operational reasons.</p><h3 id="""">How Our EHS&nbsp;Compliance Services Help</h3><p id="""">Our EHS Compliance services offer a robust tool for navigating the complex landscape of EHS regulations. We provide expert guidance on meeting federal, state, and third-party requirements, ensuring that you are always in compliance.</p><h2 id="""">EHS Prequalification</h2><h3 id="""">Why It Matters</h3><p id="""">Prequalification is essential for securing contracts and maintaining a strong business reputation. However, the process can be cumbersome and time-consuming.</p><h3 id="""">How Our EHS&nbsp;Prequalification Services Help</h3><p id="""">Our EHS Prequalification services handle the entire process for you, from gathering documentation to assessing compliance and risk factors. This ensures that you only engage with vendors and contractors who meet your EHS standards.</p><h2 id="""">EMR/XMOD Recovery</h2><h3 id="""">Why It Matters</h3><p id="""">A high EMR/XMOD rate can significantly increase your workers' compensation costs. Effective management of this metric is crucial for cost savings.</p><h3 id="""">How Our EMR/XMOD&nbsp;Services Help</h3><p id="""">Our EMR/XMOD Recovery services include a thorough analysis of your claims history and the implementation of strategies to reduce your rates, ultimately saving you money.</p><h2 id="""">Contract/MSA Recovery</h2><h3 id="""">Why It Matters</h3><p id="""">Securing contracts and MSAs is crucial for business growth. Negative EHS or risk factors can be a significant roadblock in this process.</p><h3 id="""">How Our Contract and MSA&nbsp;Recovery Services Help</h3><p id="""">Our Contract/MSA Recovery services focus on creating compelling arguments that address any negative factors, ensuring that you secure the contracts and MSAs that are critical for your business.</p><h2 id="""">Conclusion</h2><p id="""">Our Comprehensive EHS Services offer a one-stop solution for EHS Directors looking to excel in every aspect of EHS management. From training and consulting to compliance and specialized recovery services, we provide a full suite of offerings designed to meet your unique needs. By leveraging our expertise, you can achieve unparalleled levels of safety, compliance, and operational efficiency.</p>","hsla(22, 100.00%, 50.00%, 1.00)","Lorem Ipsum is simply dummy text of the printing and typesetting industry. Lorem Ipsum has been the industry's standard dummy text ever since the 1500s, when an unknown printer took a galley of type and scrambled it to make a type specimen book.",false,
EHS Training,ehs-training,64f2b0ceb3c1ea886791b59b,64f2b0cd9c0d653c3c55ca45,64f3b2f23a3dc9a344e868ea,Sat Sep 02 2023 22:10:58 GMT+0000 (Coordinated Universal Time),Wed Sep 06 2023 16:10:47 GMT+0000 (Coordinated Universal Time),Wed Sep 06 2023 16:11:02 GMT+0000 (Coordinated Universal Time),"<h1 id="""">EHS Training: Comprehensive Programs for EHS Directors to Elevate Safety and Compliance</h1><h2 id="""">Introduction</h2><p id="""">Training is a cornerstone of effective Environment, Health, and Safety (EHS) management. For EHS Directors, ensuring that employees are well-trained is not just a regulatory requirement but also a moral obligation. Our EHS Training services offer a wide range of programs designed to meet the diverse needs of your organization. In this article, we explore how our EHS Training offerings, including specialized courses like OSHA 10 and 30-hour training, First Aid, CPR, and Fall Protection, can be invaluable assets for EHS Directors.</p><h2 id="""">OSHA 10 and 30-Hour Training for Construction and General Industry</h2><h3 id="""">Why It Matters</h3><p id="""">Compliance with OSHA standards is crucial for both safety and legal reasons. The 10 and 30-hour training programs are designed to provide comprehensive safety education for workers in construction and general industry.</p><h3 id="""">How Our EHS Training Helps</h3><p id="""">Our certified trainers deliver OSHA 10 and 30-hour courses that cover a wide range of safety topics, ensuring that your employees are well-equipped to maintain a safe work environment. These courses not only meet but exceed OSHA requirements, providing both foundational and advanced safety training.</p><h2 id="""">First Aid and CPR Training</h2><h3 id="""">Why It Matters</h3><p id="""">Emergencies can happen at any time, and quick, effective response is crucial for minimizing harm. First Aid and CPR training equip employees with the skills they need to respond to medical emergencies.</p><h3 id="""">How Our EHS Training Helps</h3><p id="""">Our First Aid and CPR courses are designed to be both informative and practical, providing hands-on training that prepares employees for real-world scenarios. This ensures that your workforce is capable of providing immediate and effective medical assistance when needed.</p><h2 id="""">Fall Protection Training</h2><h3 id="""">Why It Matters</h3><p id="""">Falls are one of the leading causes of workplace injuries and fatalities, especially in industries like construction. Proper training in fall protection is essential for preventing these incidents.</p><h3 id="""">How Our EHS Training Helps</h3><p id="""">Our Fall Protection training program covers everything from the basics of fall hazards to the proper use of fall protection systems. This comprehensive training ensures that employees are well-versed in best practices for preventing falls, thereby reducing the risk of incidents.</p><h2 id="""">Customizable Training Programs</h2><h3 id="""">Why It Matters</h3><p id="""">Every organization has unique training needs based on its industry, operations, and specific challenges. Customizable training programs allow for targeted education that addresses these unique needs.</p><h3 id="""">How Our EHS Training Helps</h3><p id="""">We offer customizable training programs that can be tailored to meet the specific requirements of your organization. Whether you need specialized training in chemical handling, electrical safety, or any other subject, we've got you covered.</p><h2 id="""">Conclusion</h2><p id="""">EHS Training is not just a regulatory requirement; it's a vital component of a successful EHS program. Our comprehensive training services offer EHS Directors a robust tool for ensuring employee safety and organizational compliance. From OSHA 10 and 30-hour courses to specialized training in First Aid, CPR, and Fall Protection, our EHS Training programs are designed to meet the diverse needs of your organization. By investing in our training services, you are investing in the safety and well-being of your workforce.</p>","hsla(155, 100.00%, 50.00%, 1.00)","Lorem Ipsum is simply dummy text of the printing and typesetting industry. Lorem Ipsum has been the industry's standard dummy text ever since the 1500s, when an unknown printer took a galley of type and scrambled it to make a type specimen book.",false,
